{
  "$schema": "http://json-schema.org/draft-07/schema#",
  "title": "SlayTheSpire2RunFileV9",
  "description": "Top-level shape of the StS2 run-file export (informally 'v9'). Field set was derived from the real samples committed at references/run-samples/ — those are the canonical examples. Nested shapes inside `acts`, `players`, and `map_point_history` are not yet enforced and may be tightened in later milestones. `additionalProperties` stays `true` for the EA window since the game may add fields between patches.",
  "type": "object",
  "required": [
    "build_id",
    "schema_version",
    "seed",
    "start_time",
    "was_abandoned",
    "win",
    "ascension",
    "game_mode",
    "platform_type",
    "run_time"
  ],
  "additionalProperties": true,
  "properties": {
    "schema_version": {
      "type": "integer",
      "description": "Game-emitted schema version. Observed values: 8 (older patch) and 9 (current). Not enforced strictly — the importer maps both."
    },
    "build_id": {
      "type": "string",
      "description": "Game build label, e.g. \"v0.103.2\"."
    },
    "seed": {
      "type": "string",
      "description": "Run seed string."
    },
    "start_time": {
      "type": "integer",
      "minimum": 0,
      "description": "Unix epoch seconds at run start."
    },
    "run_time": {
      "type": "integer",
      "minimum": 0,
      "description": "Total duration in seconds. Importer derives end time as start_time + run_time."
    },
    "was_abandoned": {
      "type": "boolean",
      "description": "True if the player abandoned the run. Combined with `win`, encodes outcome: (false,true)=victory, (false,false)=defeat, (true,*)=abandoned."
    },
    "win": {
      "type": "boolean",
      "description": "True if the run reached a victory condition."
    },
    "ascension": {
      "type": "integer",
      "minimum": 0
    },
    "game_mode": {
      "type": "string",
      "description": "e.g. \"standard\"."
    },
    "platform_type": {
      "type": "string",
      "description": "e.g. \"steam\"."
    },
    "killed_by_encounter": {
      "type": "string",
      "description": "Encounter id that killed the run, e.g. \"ENCOUNTER.PHANTASMAL_GARDENERS_ELITE\". \"NONE.NONE\" when not applicable."
    },
    "killed_by_event": {
      "type": "string",
      "description": "Event id that killed the run. \"NONE.NONE\" when not applicable."
    },
    "acts": {
      "type": "array",
      "description": "Ordered list of acts the run progressed through. Inner shape not enforced yet."
    },
    "players": {
      "type": "array",
      "description": "Per-player state at run end (single-player runs have one element). Inner shape not enforced yet."
    },
    "map_point_history": {
      "type": "array",
      "description": "Per-act sequence of map points visited and their outcomes. Inner shape not enforced yet."
    },
    "modifiers": {
      "type": "array",
      "description": "Run modifiers (daily climb, custom seed, etc.). Inner shape not enforced yet."
    }
  }
}
