{
  "schema_version": 9,
  "build_id": "v0.103.2",
  "seed": "MNOPQRSTUV",
  "start_time": 1777007901,
  "run_time": 2352,
  "was_abandoned": true,
  "win": false,
  "ascension": 7,
  "game_mode": "standard",
  "platform_type": "steam",
  "killed_by_encounter": "ENCOUNTER.DECIMILLIPEDE_ELITE",
  "killed_by_event": "NONE.NONE",
  "acts": [
    "ACT.UNDERDOCKS",
    "ACT.HIVE"
  ],
  "players": [
    {
      "id": "player_anon_0001",
      "character": "CHARACTER.IRONCLAD"
    }
  ],
  "map_point_history": [],
  "modifiers": []
}
