{
  "schema_version": 9,
  "build_id": "v0.103.2",
  "seed": "ABCDEFGHIJ",
  "start_time": 1776658411,
  "run_time": 5371,
  "was_abandoned": false,
  "win": true,
  "ascension": 7,
  "game_mode": "standard",
  "platform_type": "steam",
  "killed_by_encounter": "NONE.NONE",
  "killed_by_event": "NONE.NONE",
  "acts": [
    "ACT.UNDERDOCKS",
    "ACT.HIVE",
    "ACT.GLORY"
  ],
  "players": [
    {
      "id": "player_anon_0001",
      "character": "CHARACTER.SCRAP_KNIGHT"
    }
  ],
  "map_point_history": [],
  "modifiers": []
}
